<?xml version="1.0" encoding="UTF-8"?>
<xs:schema attributeFormDefault="unqualified" elementFormDefault="qualified" xmlns:xs="http://www.w3.org/2001/XMLSchema">
  <xs:element name="level" type="levelType"/>
  <xs:complexType name="rowType">
    <xs:sequence>
      <xs:element name="cell" maxOccurs="unbounded" minOccurs="0">
        <xs:complexType mixed="true">
          <xs:sequence>
            <xs:element type="xs:string" name="block" minOccurs="0"/>
          </xs:sequence>
        </xs:complexType>
      </xs:element>
    </xs:sequence>
  </xs:complexType>
  <xs:complexType name="levelType">
    <xs:sequence>
      <xs:element type="blocksType" name="blocks">
        <xs:annotation>
          <xs:documentation>field height = 600field width = 500bat height = 15 ball height = 10. 2 rows are occupied by them,
    so we have 38 rows
    and 10 columnsblock size = 100 x 15</xs:documentation>
        </xs:annotation>
      </xs:element>
      <xs:element type="xs:string" name="bat"/>
      <xs:element type="xs:string" name="ball"/>
    </xs:sequence>
  </xs:complexType>
  <xs:complexType name="cellType">
    <xs:sequence>
      <xs:element type="xs:string" name="block" minOccurs="0"/>
    </xs:sequence>
  </xs:complexType>
  <xs:complexType name="blocksType">
    <xs:sequence>
      <xs:element type="rowType" name="row" maxOccurs="unbounded" minOccurs="0"/>
    </xs:sequence>
  </xs:complexType>
</xs:schema>