<?xml version="1.0" encoding="utf-8"
        xmlns="http://www.w3schools.com"
        xmlns:xsi="http://www.w3.org/2001/XMLSchema-instance"
        xsi:schemaLocation="http://www.w3schools.com level.xsd"
        ?>
<level>
    <!--field height = 600-->
    <!--field width = 500-->
    <!--bat height = 15 ball height = 10. 2 rows are occupied by them,
    so we have 38 rows
    and 10 columns-->
    <!--block size = 100 x 15-->
    <blocks>
        <row>
            <cell><block type="" bonus=""/></cell>
            <cell><block/></cell>
            <cell><block/></cell>
            <cell><block/></cell>
            <cell><block/></cell>
            <cell><block/></cell>
            <cell><block/></cell>
            <cell><block/></cell>
            <cell><block/></cell>
            <cell><block/></cell>
        </row>
        <row>
            <cell><block/></cell>
            <cell><block/></cell>
            <cell><block/></cell>
            <cell><block/></cell>
            <cell><block/></cell>
            <cell><block/></cell>
            <cell><block/></cell>
            <cell><block/></cell>
            <cell><block/></cell>
            <cell><block/></cell>
        </row>
        <row>
            <cell><block/></cell>
            <cell><block/></cell>
            <cell><block/></cell>
            <cell><block/></cell>
            <cell><block/></cell>
            <cell><block/></cell>
            <cell><block/></cell>
            <cell><block/></cell>
            <cell><block/></cell>
            <cell><block/></cell>
        </row>
        <row>
            <cell><block/></cell>
            <cell><block/></cell>
            <cell><block/></cell>
            <cell><block/></cell>
            <cell><block/></cell>
            <cell><block/></cell>
            <cell><block/></cell>
            <cell><block/></cell>
            <cell><block/></cell>
            <cell><block/></cell>
        </row>
        <row>
            <cell><block/></cell>
            <cell><block/></cell>
            <cell><block/></cell>
            <cell><block/></cell>
            <cell><block/></cell>
            <cell><block/></cell>
            <cell><block/></cell>
            <cell><block/></cell>
            <cell><block/></cell>
            <cell><block/></cell>
        </row>
        <row>
            <cell><block/></cell>
            <cell><block/></cell>
            <cell><block/></cell>
            <cell><block/></cell>
            <cell><block/></cell>
            <cell><block/></cell>
            <cell><block/></cell>
            <cell><block/></cell>
            <cell><block/></cell>
            <cell><block/></cell>
        </row>
        <row>
            <cell><block/></cell>
            <cell><block/></cell>
            <cell><block/></cell>
            <cell><block/></cell>
            <cell><block/></cell>
            <cell><block/></cell>
            <cell><block/></cell>
            <cell><block/></cell>
            <cell><block/></cell>
            <cell><block/></cell>
        </row>
        <row>
            <cell><block/></cell>
            <cell><block/></cell>
            <cell><block/></cell>
            <cell><block/></cell>
            <cell><block/></cell>
            <cell><block/></cell>
            <cell><block/></cell>
            <cell><block/></cell>
            <cell><block/></cell>
            <cell><block/></cell>
        </row>
        <row>
            <cell><block/></cell>
            <cell><block/></cell>
            <cell><block/></cell>
            <cell><block/></cell>
            <cell><block/></cell>
            <cell><block/></cell>
            <cell><block/></cell>
            <cell><block/></cell>
            <cell><block/></cell>
            <cell><block/></cell>
        </row>
        <row>
            <cell><block/></cell>
            <cell><block/></cell>
            <cell><block/></cell>
            <cell><block/></cell>
            <cell><block/></cell>
            <cell><block/></cell>
            <cell><block/></cell>
            <cell><block/></cell>
            <cell><block/></cell>
            <cell><block/></cell>
        </row>
    </blocks>
    <bat></bat>
    <ball></ball>
</level>